{
  "contract_version": "1.0.0",
  "request_id": "cb240d42-d405-406f-b771-cf0f78e8ee6e",
  "schema_version": "1.1.0",
  "graph_version": "0.1.0-review-307029129712",
  "index_version": "hybrid-1-release-profile-1",
  "policy_version": "1.0.0",
  "data": {
    "query": "中枢是什么，最低级别的定义有什么不同？",
    "mode": "knowledge",
    "status": "found",
    "answer_support": "not_assessed_by_retrieval",
    "reviewed": [
      {
        "id": "upper-l017-center-definition",
        "text": "走势中枢是某级别走势类型中，至少三个连续次级别走势类型所重叠的部分。",
        "kind": "explicit",
        "conditions": [
          "至少三个",
          "连续",
          "次级别走势类型",
          "前三个次级别走势类型均已完成"
        ],
        "exceptions": [],
        "concept_ids": [
          "concept-ca31d0f4fbdd0c07",
          "concept-3403e6e29ce58f3f",
          "concept-52a9eab5f7eee9ff"
        ],
        "review_status": "reviewed",
        "ambiguity_status": "none",
        "review_note": "先按17课定义抽取，再复读18课计算说明补齐前三个均完成的限制；已视觉核对PDF76页定义，未以读者转述充作证据。",
        "derivation": {},
        "importance_level": 1,
        "importance_reason": "基本定义、核心定理或直接影响成立性的关键边界。",
        "evidence": [
          {
            "id": "evidence-6d07bb0f0b247d01",
            "claim_id": "upper-l017-center-definition",
            "passage_id": "volume_1-a53e99c37ca5-p0076-b003",
            "quote": "为了深入研究这复杂问题，必须先引入缠中说禅走势中枢的概念：某级别走势类型中，被至少三个连续次级别走势类型所重叠的部分，称为缠中说禅走势中枢。换言之，缠中说禅走势中枢就是至少三个连续次级别走势类型重叠部分所构成。这里有一个递归的问题，就是这次级别不能无限下去，就像有些半吊子哲学胡诌什么“一分为二”，而“分”不是无限的，按照量子力学，物质之分是有极限的，同样，级别之次也不可能无限，在实际之中，对最后不能分解的级别，其缠中说禅走势中枢就不能用“至少三个连续次级别走势类型所重叠”定义，而定义为至少三个该级别单位K线重叠部分。一般来说，对实际操作，都把这最低的不可分解级别设定为1分钟或5分钟线，当然，也可以设定为1秒种线，但这都没有太大区别。",
            "quote_start": 0,
            "quote_end": 320,
            "source_spans": [
              {
                "document_id": "volume_1-a53e99c37ca5",
                "pdf_page": 76,
                "char_indices": [
                  707,
                  708,
                  709,
                  710,
                  711,
                  712,
                  713,
                  714,
                  715,
                  716,
                  717,
                  718,
                  719,
                  720,
                  721,
                  722,
                  723,
                  724,
                  725,
                  726,
                  727,
                  728,
                  729,
                  730,
                  731,
                  732,
                  733,
                  734,
                  735,
                  736,
                  737,
                  738,
                  739,
                  740,
                  741,
                  742,
                  743,
                  744,
                  745,
                  746,
                  747,
                  748,
                  749,
                  750,
                  751,
                  752,
                  753,
                  754,
                  755,
                  756,
                  757,
                  758,
                  759,
                  760,
                  761,
                  762,
                  763,
                  764,
                  765,
                  766,
                  767,
                  768,
                  769,
                  770,
                  771,
                  772,
                  773,
                  774,
                  775,
                  776,
                  777,
                  778,
                  779,
                  780,
                  781,
                  782,
                  783,
                  784,
                  785,
                  786,
                  787,
                  788,
                  789,
                  790,
                  791,
                  792,
                  793,
                  794,
                  795,
                  796,
                  797,
                  798,
                  799,
                  800,
                  801,
                  802,
                  803,
                  804,
                  805,
                  806,
                  807,
                  808,
                  809,
                  810,
                  811,
                  812,
                  813,
                  814,
                  815,
                  816,
                  817,
                  818,
                  819,
                  820,
                  821,
                  822,
                  823,
                  824,
                  825,
                  826,
                  827,
                  828,
                  829,
                  830,
                  831,
                  832,
                  833,
                  834,
                  835,
                  836,
                  837,
                  838,
                  839,
                  840,
                  841,
                  842,
                  843,
                  844,
                  845,
                  846,
                  847,
                  848,
                  849,
                  850,
                  851,
                  852,
                  853,
                  854,
                  855,
                  856,
                  857,
                  858,
                  859,
                  860,
                  861,
                  862,
                  863,
                  864,
                  865,
                  866,
                  867,
                  868,
                  869,
                  870,
                  871,
                  872,
                  873,
                  874,
                  875,
                  876,
                  877,
                  878,
                  879,
                  880,
                  881,
                  882,
                  883,
                  884,
                  885,
                  886,
                  887,
                  888,
                  889,
                  890,
                  891,
                  892,
                  893,
                  894,
                  895,
                  896,
                  897,
                  898,
                  899,
                  900,
                  901,
                  902,
                  903,
                  904,
                  905,
                  906,
                  907,
                  908,
                  909,
                  910,
                  911,
                  912,
                  913,
                  914,
                  915,
                  916,
                  917,
                  918,
                  919,
                  920,
                  921,
                  922,
                  923,
                  924,
                  925,
                  926,
                  927,
                  928,
                  929,
                  930,
                  931,
                  932,
                  933,
                  934,
                  935,
                  936,
                  937,
                  938,
                  939,
                  940,
                  941,
                  942,
                  943,
                  944,
                  945,
                  946,
                  947,
                  948,
                  949,
                  950,
                  951,
                  952,
                  953,
                  954,
                  955,
                  956,
                  957,
                  958,
                  959,
                  960,
                  961,
                  962,
                  963,
                  964,
                  965,
                  966,
                  967,
                  968,
                  969,
                  970,
                  971,
                  972,
                  973,
                  974,
                  975,
                  976,
                  977,
                  978,
                  979,
                  980,
                  981,
                  982,
                  983,
                  984,
                  985,
                  986,
                  987,
                  988,
                  989,
                  990,
                  991,
                  992,
                  993,
                  994,
                  995,
                  996,
                  997,
                  998,
                  999,
                  1000,
                  1001,
                  1002,
                  1003,
                  1004,
                  1005,
                  1006,
                  1007,
                  1008,
                  1009,
                  1010,
                  1011,
                  1012,
                  1013,
                  1014,
                  1015,
                  1016,
                  1017,
                  1018,
                  1019,
                  1020,
                  1021,
                  1022,
                  1023,
                  1024,
                  1025,
                  1026
                ],
                "boxes": [
                  [
                    80.688,
                    408.665,
                    509.917,
                    420.545
                  ],
                  [
                    56.544,
                    428.105,
                    512.474,
                    439.985
                  ],
                  [
                    56.544,
                    447.545,
                    509.661,
                    459.425
                  ],
                  [
                    56.544,
                    467.015,
                    509.945,
                    479.786
                  ],
                  [
                    56.544,